Last login: Sat May 16 12:56:34 on ttys000
Dtown@Dezs-MacBook-Air ~ % echo 'export PATH=/usr/local/mysql/bin:$PATH' >> ~/.bash_profile
Dtown@Dezs-MacBook-Air ~ % . ~/.bash_profile
Dtown@Dezs-MacBook-Air ~ % env
TMPDIR=/var/folders/86/2t8s25710vlgkx0z37cgzcn00000gn/T/
XPC_FLAGS=0x0
TERM_PROGRAM_VERSION=433
LANG=en_US.UTF-8
TERM_PROGRAM=Apple_Terminal
XPC_SERVICE_NAME=0
TERM_SESSION_ID=12B0A858-E50B-4740-B662-9AE5AE7F420A
TERM=xterm-256color
SSH_AUTH_SOCK=/private/tmp/com.apple.launchd.2OdoqFelHZ/Listeners
SHELL=/bin/zsh
HOME=/Users/Dtown
LOGNAME=Dtown
USER=Dtown
PATH=/usr/local/mysql/bin:/usr/local/mysql/bin:/usr/local/mysql/bin:/usr/local/mysql/bin:/usr/local/mysql/bin:/usr/local/mysql/bin:/usr/local/mysql/bin:/usr/local/mysql/bin:/usr/local/mysql/bin:/usr/local/mysql/bin:/usr/local/mysql/bin:/usr/local/mysql/bin:/usr/local/mysql/bin:/usr/local/mysql/bin:/usr/local/mysql/bin:/usr/local/mysql/bin:/usr/local/mysql/bin:/usr/local/mysql/bin:/usr/local/mysql/bin:/usr/local/mysql/bin:/usr/local/bin:/usr/bin:/bin:/usr/sbin:/sbin:/Library/Apple/usr/bin
SHLVL=1
PWD=/Users/Dtown
OLDPWD=/Users/Dtown
_=/usr/bin/env
Dtown@Dezs-MacBook-Air ~ % mysql -u root -p
Enter password: 
Welcome to the MySQL monitor.  Commands end with ; or \g.
Your MySQL connection id is 43
Server version: 8.0.20 MySQL Community Server - GPL

Copyright (c) 2000, 2020, Oracle and/or its affiliates. All rights reserved.

Oracle is a registered trademark of Oracle Corporation and/or its
affiliates. Other names may be trademarks of their respective
owners.

Type 'help;' or '\h' for help. Type '\c' to clear the current input statement.

mysql> show databases;
+--------------------+
| Database           |
+--------------------+
| employees          |
| information_schema |
| mysql              |
| performance_schema |
| sys                |
+--------------------+
5 rows in set (0.36 sec)

mysql> show employees;
ERROR 1064 (42000): You have an error in your SQL syntax; check the manual that corresponds to your MySQL server version for the right syntax to use near 'employees' at line 1
mysql> SELECT * FROM employees WHERE birth_date > 1965-01-01 LIMIT 50;
ERROR 1046 (3D000): No database selected
mysql> SELECT * employees LIMIT 10;
ERROR 1064 (42000): You have an error in your SQL syntax; check the manual that corresponds to your MySQL server version for the right syntax to use near 'employees LIMIT 10' at line 1
mysql> use employees;
Reading table information for completion of table and column names
You can turn off this feature to get a quicker startup with -A

Database changed
mysql> show employees;
ERROR 1064 (42000): You have an error in your SQL syntax; check the manual that corresponds to your MySQL server version for the right syntax to use near 'employees' at line 1
mysql> show tables;
+----------------------+
| Tables_in_employees  |
+----------------------+
| current_dept_emp     |
| departments          |
| dept_emp             |
| dept_emp_latest_date |
| dept_manager         |
| employees            |
| salaries             |
| titles               |
+----------------------+
8 rows in set (0.01 sec)

mysql> SELECT * FROM employees WHERE birth_date > 1965-01-01 LIMIT 50;
+--------+------------+------------+-------------+--------+------------+
| emp_no | birth_date | first_name | last_name   | gender | hire_date  |
+--------+------------+------------+-------------+--------+------------+
|  10008 | 1958-02-19 | Saniya     | Kalloufi    | M      | 1994-09-15 |
|  10009 | 1952-04-19 | Sumant     | Peac        | F      | 2002-01-01 |
|  10010 | 1963-06-01 | Duangkaew  | Piveteau    | F      | 2002-01-01 |
|  10011 | 1953-11-07 | Mary       | Sluis       | F      | 1990-01-22 |
|  10012 | 1960-10-04 | Patricio   | Bridgland   | M      | 2002-01-01 |
|  10013 | 1963-06-07 | Eberhardt  | Terkki      | M      | 1985-10-20 |
|  10015 | 1959-08-19 | Guoxiang   | Nooteboom   | M      | 1987-07-02 |
|  10016 | 1961-05-02 | Kazuhito   | Cappelletti | M      | 1995-01-27 |
|  10017 | 1958-07-06 | Cristinel  | Bouloucos   | F      | 1993-08-03 |
|  10018 | 1954-06-19 | Kazuhide   | Peha        | F      | 2002-01-01 |
|  10019 | 1953-01-23 | Lillian    | Haddadi     | M      | 1999-04-30 |
|  10020 | 1952-12-24 | Mayuko     | Warwick     | M      | 1991-01-26 |
|  10021 | 1960-02-20 | Ramzi      | Erde        | M      | 1988-02-10 |
|  10022 | 1952-07-08 | Shahaf     | Famili      | M      | 1995-08-22 |
|  10023 | 1953-09-29 | BOB        | Montemayor  | F      | 1989-12-17 |
|  10024 | 1958-09-05 | Suzette    | Pettey      | F      | 2002-01-01 |
|  10025 | 1958-10-31 | Prasadram  | Heyers      | M      | 2002-01-01 |
|  10026 | 1953-04-03 | Yongqiao   | Berztiss    | M      | 1995-03-20 |
|  10027 | 1962-07-10 | Divier     | Reistad     | F      | 1989-07-07 |
|  10028 | 1963-11-26 | Domenick   | Tempesti    | M      | 1991-10-22 |
|  10029 | 1956-12-13 | Otmar      | Herbst      | M      | 1985-11-20 |
|  10030 | 1958-07-14 | Elvis      | Demeyer     | M      | 1994-02-17 |
|  10031 | 1959-01-27 | Karsten    | Joslin      | M      | 1991-09-01 |
|  10032 | 1960-08-09 | Jeong      | Reistad     | F      | 1990-06-20 |
|  10033 | 1956-11-14 | Arif       | Merlo       | M      | 1987-03-18 |
|  10034 | 1962-12-29 | Bader      | Swan        | M      | 1988-09-21 |
|  10035 | 1953-02-08 | Alain      | Chappelet   | M      | 1988-09-05 |
|  10036 | 1959-08-10 | Adamantios | Portugali   | M      | 2002-01-01 |
|  10037 | 1963-07-22 | Pradeep    | Makrucki    | M      | 2002-01-01 |
|  10038 | 1960-07-20 | Huan       | Lortz       | M      | 1989-09-20 |
|  10039 | 1959-10-01 | Alejandro  | Brender     | M      | 1988-01-19 |
|  10040 | 1959-09-13 | Weiyi      | Meriste     | F      | 1993-02-14 |
|  10041 | 1959-08-27 | Uri        | Lenart      | F      | 1989-11-12 |
|  10042 | 1956-02-26 | Magy       | Stamatiou   | F      | 1993-03-21 |
|  10043 | 1960-09-19 | Yishay     | Tzvieli     | M      | 1990-10-20 |
|  10044 | 1961-09-21 | Mingsen    | Casley      | F      | 1994-05-21 |
|  10045 | 1957-08-14 | Moss       | Shanbhogue  | M      | 1989-09-02 |
|  10046 | 1960-07-23 | Lucien     | Rosenbaum   | M      | 1992-06-20 |
|  10047 | 1952-06-29 | Zvonko     | Nyanchama   | M      | 1989-03-31 |
|  10049 | 1961-04-24 | Basil      | Tramer      | F      | 1992-05-04 |
|  10050 | 1958-05-21 | Yinghua    | Dredge      | M      | 1990-12-25 |
|  10051 | 1953-07-28 | Hidefumi   | Caine       | M      | 1992-10-15 |
|  10052 | 1961-02-26 | Heping     | Nitsch      | M      | 1988-05-21 |
|  10053 | 1954-09-13 | Sanjiv     | Zschoche    | F      | 1986-02-04 |
|  10054 | 1957-04-04 | Mayumi     | Schueller   | M      | 1995-03-13 |
|  10055 | 1956-06-06 | Georgy     | Dredge      | M      | 1992-04-27 |
|  10056 | 1961-09-01 | Brendon    | Bernini     | F      | 1990-02-01 |
|  10057 | 1954-05-30 | Ebbe       | Callaway    | F      | 1992-01-15 |
|  10058 | 1954-10-01 | Berhard    | McFarlin    | M      | 1987-04-13 |
|  10059 | 1953-09-19 | Alejandro  | McAlpine    | F      | 1991-06-26 |
+--------+------------+------------+-------------+--------+------------+
50 rows in set, 1 warning (0.01 sec)

mysql> SELECT * FROM employees WHERE gender = 'F' AND hire_date >' 1990-01-01 LIMIT 10;
    '> ^C

^C
mysql> SELECT * FROM employees WHERE gender = 'F' AND hire_date > '1990-01-01' LIMIT 10;
+--------+------------+------------+-----------+--------+------------+
| emp_no | birth_date | first_name | last_name | gender | hire_date  |
+--------+------------+------------+-----------+--------+------------+
|  10009 | 1952-04-19 | Sumant     | Peac      | F      | 2002-01-01 |
|  10010 | 1963-06-01 | Duangkaew  | Piveteau  | F      | 2002-01-01 |
|  10011 | 1953-11-07 | Mary       | Sluis     | F      | 1990-01-22 |
|  10017 | 1958-07-06 | Cristinel  | Bouloucos | F      | 1993-08-03 |
|  10018 | 1954-06-19 | Kazuhide   | Peha      | F      | 2002-01-01 |
|  10024 | 1958-09-05 | Suzette    | Pettey    | F      | 2002-01-01 |
|  10032 | 1960-08-09 | Jeong      | Reistad   | F      | 1990-06-20 |
|  10040 | 1959-09-13 | Weiyi      | Meriste   | F      | 1993-02-14 |
|  10042 | 1956-02-26 | Magy       | Stamatiou | F      | 1993-03-21 |
|  10044 | 1961-09-21 | Mingsen    | Casley    | F      | 1994-05-21 |
+--------+------------+------------+-----------+--------+------------+
10 rows in set (0.01 sec)

mysql> SELECT first_name, last_name FROM employees WHERE last_name LIKE 'F%' LIMIT 50;
+-------------+--------------+
| first_name  | last_name    |
+-------------+--------------+
| Shahaf      | Famili       |
| Somnath     | Foote        |
| Sudharsan   | Flasterstein |
| Armond      | Fairtlough   |
| Ewing       | Foong        |
| Sumali      | Fargier      |
| Badri       | Furudate     |
| Arve        | Fairtlough   |
| Mohua       | Falck        |
| Pranav      | Furedi       |
| Kish        | Fasbender    |
| Foong       | Flasterstein |
| Roded       | Facello      |
| Clyde       | Fandrianto   |
| Anneli      | Frijda       |
| Masoud      | Fabrizio     |
| Przemyslawa | Falby        |
| Hisao       | Famili       |
| Lalit       | Francisci    |
| Heejo       | Frolund      |
| Otmar       | Feinberg     |
| Unal        | Fendler      |
| Yuchang     | Francisci    |
| Chenyi      | Feinberg     |
| Shim        | Feldhoffer   |
| Ashish      | Fortenbacher |
| Fan         | Fairtlough   |
| Fen         | Fiebach      |
| Ramzi       | Furudate     |
| Oscal       | Fasbender    |
| Morris      | Famili       |
| Aleksander  | Fioravanti   |
| Chiradeep   | Furedi       |
| Shin        | Foote        |
| Deniz       | Fontan       |
| Nathan      | Flowers      |
| Tse         | Felcyn       |
| Tadahiro    | Fordan       |
| Sahrah      | Figueira     |
| Dayanand    | Figueira     |
| Kwangjo     | Fiebach      |
| Gina        | Falster      |
| Bernice     | Felcyn       |
| Sreenivas   | Farrag       |
| Lillian     | Fontet       |
| Ult         | Farrar       |
| Heping      | Fontan       |
| Xiong       | Ferriere     |
| Kasturi     | Fraisse      |
| Jungsoon    | Fiebach      |
+-------------+--------------+
50 rows in set (0.02 sec)

mysql> INSERT INTO employees VALUES(100, '1998-06-11', 'Dez', 'Young', 'M', '2020-07-25');
Query OK, 1 row affected (0.05 sec)

mysql> SELECT * FROM employees LIMIT 10;
+--------+------------+------------+-------------+--------+------------+
| emp_no | birth_date | first_name | last_name   | gender | hire_date  |
+--------+------------+------------+-------------+--------+------------+
|    100 | 1998-06-11 | Dez        | Young       | M      | 2020-07-25 |
|  10008 | 1958-02-19 | Saniya     | Kalloufi    | M      | 1994-09-15 |
|  10009 | 1952-04-19 | Sumant     | Peac        | F      | 2002-01-01 |
|  10010 | 1963-06-01 | Duangkaew  | Piveteau    | F      | 2002-01-01 |
|  10011 | 1953-11-07 | Mary       | Sluis       | F      | 1990-01-22 |
|  10012 | 1960-10-04 | Patricio   | Bridgland   | M      | 2002-01-01 |
|  10013 | 1963-06-07 | Eberhardt  | Terkki      | M      | 1985-10-20 |
|  10015 | 1959-08-19 | Guoxiang   | Nooteboom   | M      | 1987-07-02 |
|  10016 | 1961-05-02 | Kazuhito   | Cappelletti | M      | 1995-01-27 |
|  10017 | 1958-07-06 | Cristinel  | Bouloucos   | F      | 1993-08-03 |
+--------+------------+------------+-------------+--------+------------+
10 rows in set (0.01 sec)

mysql> INSERT INTO employees VALUES(100, '1996-01-23', 'Jay', 'Young', 'F', '2018-01-25');
ERROR 1062 (23000): Duplicate entry '100' for key 'employees.PRIMARY'
mysql> INSERT INTO employees VALUES(101, '1996-01-23', 'Jay', 'Young', 'F', '2018-01-25');
Query OK, 1 row affected (0.01 sec)

mysql> SELECT * FROM employees LIMIT 10;
+--------+------------+------------+-------------+--------+------------+
| emp_no | birth_date | first_name | last_name   | gender | hire_date  |
+--------+------------+------------+-------------+--------+------------+
|    100 | 1998-06-11 | Dez        | Young       | M      | 2020-07-25 |
|    101 | 1996-01-23 | Jay        | Young       | F      | 2018-01-25 |
|  10008 | 1958-02-19 | Saniya     | Kalloufi    | M      | 1994-09-15 |
|  10009 | 1952-04-19 | Sumant     | Peac        | F      | 2002-01-01 |
|  10010 | 1963-06-01 | Duangkaew  | Piveteau    | F      | 2002-01-01 |
|  10011 | 1953-11-07 | Mary       | Sluis       | F      | 1990-01-22 |
|  10012 | 1960-10-04 | Patricio   | Bridgland   | M      | 2002-01-01 |
|  10013 | 1963-06-07 | Eberhardt  | Terkki      | M      | 1985-10-20 |
|  10015 | 1959-08-19 | Guoxiang   | Nooteboom   | M      | 1987-07-02 |
|  10016 | 1961-05-02 | Kazuhito   | Cappelletti | M      | 1995-01-27 |
+--------+------------+------------+-------------+--------+------------+
10 rows in set (0.00 sec)

mysql> INSERT INTO employees VALUES(102, '1978-07-31', 'Jr', 'Santillan', 'M', '2015-04-16');
Query OK, 1 row affected (0.00 sec)

mysql> SELECT * FROM employees LIMIT 10;
+--------+------------+------------+-----------+--------+------------+
| emp_no | birth_date | first_name | last_name | gender | hire_date  |
+--------+------------+------------+-----------+--------+------------+
|    100 | 1998-06-11 | Dez        | Young     | M      | 2020-07-25 |
|    101 | 1996-01-23 | Jay        | Young     | F      | 2018-01-25 |
|    102 | 1978-07-31 | Jr         | Santillan | M      | 2015-04-16 |
|  10008 | 1958-02-19 | Saniya     | Kalloufi  | M      | 1994-09-15 |
|  10009 | 1952-04-19 | Sumant     | Peac      | F      | 2002-01-01 |
|  10010 | 1963-06-01 | Duangkaew  | Piveteau  | F      | 2002-01-01 |
|  10011 | 1953-11-07 | Mary       | Sluis     | F      | 1990-01-22 |
|  10012 | 1960-10-04 | Patricio   | Bridgland | M      | 2002-01-01 |
|  10013 | 1963-06-07 | Eberhardt  | Terkki    | M      | 1985-10-20 |
|  10015 | 1959-08-19 | Guoxiang   | Nooteboom | M      | 1987-07-02 |
+--------+------------+------------+-----------+--------+------------+
10 rows in set (0.00 sec)

mysql> UPDATE employees SET first_name = 'BOB' WHERE emp_no = 10023;
Query OK, 0 rows affected (0.01 sec)
Rows matched: 1  Changed: 0  Warnings: 0

mysql> SELECT * FROM employees WHERE emp_no = 10023;
+--------+------------+------------+------------+--------+------------+
| emp_no | birth_date | first_name | last_name  | gender | hire_date  |
+--------+------------+------------+------------+--------+------------+
|  10023 | 1953-09-29 | BOB        | Montemayor | F      | 1989-12-17 |
+--------+------------+------------+------------+--------+------------+
1 row in set (0.00 sec)

mysql> UPDATE employees SET hire_ date = '2002-01-01' first_name LIKE 'P%' OR last_name LIKE 'P%';
ERROR 1064 (42000): You have an error in your SQL syntax; check the manual that corresponds to your MySQL server version for the right syntax to use near 'date = '2002-01-01' first_name LIKE 'P%' OR last_name LIKE 'P%'' at line 1
mysql> UPDATE employees SET hire_date = '2002-01-01' first_name LIKE 'P%' OR last_name LIKE 'P%';
ERROR 1064 (42000): You have an error in your SQL syntax; check the manual that corresponds to your MySQL server version for the right syntax to use near 'first_name LIKE 'P%' OR last_name LIKE 'P%'' at line 1
mysql> UPDATE employees SET hire_date = '2002-01-01' WHERE first_name LIKE 'P%' OR last_name LIKE 'P%';
Query OK, 0 rows affected (0.58 sec)
Rows matched: 31564  Changed: 0  Warnings: 0

mysql> SELECT * FROM employees LIMIT 10;
+--------+------------+------------+-----------+--------+------------+
| emp_no | birth_date | first_name | last_name | gender | hire_date  |
+--------+------------+------------+-----------+--------+------------+
|    100 | 1998-06-11 | Dez        | Young     | M      | 2020-07-25 |
|    101 | 1996-01-23 | Jay        | Young     | F      | 2018-01-25 |
|    102 | 1978-07-31 | Jr         | Santillan | M      | 2015-04-16 |
|  10008 | 1958-02-19 | Saniya     | Kalloufi  | M      | 1994-09-15 |
|  10009 | 1952-04-19 | Sumant     | Peac      | F      | 2002-01-01 |
|  10010 | 1963-06-01 | Duangkaew  | Piveteau  | F      | 2002-01-01 |
|  10011 | 1953-11-07 | Mary       | Sluis     | F      | 1990-01-22 |
|  10012 | 1960-10-04 | Patricio   | Bridgland | M      | 2002-01-01 |
|  10013 | 1963-06-07 | Eberhardt  | Terkki    | M      | 1985-10-20 |
|  10015 | 1959-08-19 | Guoxiang   | Nooteboom | M      | 1987-07-02 |
+--------+------------+------------+-----------+--------+------------+
10 rows in set (0.00 sec)

mysql> DELETE FROM employees WHERE emp_no < 10000;
Query OK, 3 rows affected (0.04 sec)

mysql> SELECT * FROM employees LIMIT 10;
+--------+------------+------------+-------------+--------+------------+
| emp_no | birth_date | first_name | last_name   | gender | hire_date  |
+--------+------------+------------+-------------+--------+------------+
|  10008 | 1958-02-19 | Saniya     | Kalloufi    | M      | 1994-09-15 |
|  10009 | 1952-04-19 | Sumant     | Peac        | F      | 2002-01-01 |
|  10010 | 1963-06-01 | Duangkaew  | Piveteau    | F      | 2002-01-01 |
|  10011 | 1953-11-07 | Mary       | Sluis       | F      | 1990-01-22 |
|  10012 | 1960-10-04 | Patricio   | Bridgland   | M      | 2002-01-01 |
|  10013 | 1963-06-07 | Eberhardt  | Terkki      | M      | 1985-10-20 |
|  10015 | 1959-08-19 | Guoxiang   | Nooteboom   | M      | 1987-07-02 |
|  10016 | 1961-05-02 | Kazuhito   | Cappelletti | M      | 1995-01-27 |
|  10017 | 1958-07-06 | Cristinel  | Bouloucos   | F      | 1993-08-03 |
|  10018 | 1954-06-19 | Kazuhide   | Peha        | F      | 2002-01-01 |
+--------+------------+------------+-------------+--------+------------+
10 rows in set (0.00 sec)

mysql> DELETE FROM employees WHERE emp_no IN (10048, 10099, 10234, 20089);
Query OK, 0 rows affected (0.00 sec)

mysql> SELECT * FROM employees LIMIT 10;
+--------+------------+------------+-------------+--------+------------+
| emp_no | birth_date | first_name | last_name   | gender | hire_date  |
+--------+------------+------------+-------------+--------+------------+
|  10008 | 1958-02-19 | Saniya     | Kalloufi    | M      | 1994-09-15 |
|  10009 | 1952-04-19 | Sumant     | Peac        | F      | 2002-01-01 |
|  10010 | 1963-06-01 | Duangkaew  | Piveteau    | F      | 2002-01-01 |
|  10011 | 1953-11-07 | Mary       | Sluis       | F      | 1990-01-22 |
|  10012 | 1960-10-04 | Patricio   | Bridgland   | M      | 2002-01-01 |
|  10013 | 1963-06-07 | Eberhardt  | Terkki      | M      | 1985-10-20 |
|  10015 | 1959-08-19 | Guoxiang   | Nooteboom   | M      | 1987-07-02 |
|  10016 | 1961-05-02 | Kazuhito   | Cappelletti | M      | 1995-01-27 |
|  10017 | 1958-07-06 | Cristinel  | Bouloucos   | F      | 1993-08-03 |
|  10018 | 1954-06-19 | Kazuhide   | Peha        | F      | 2002-01-01 |
+--------+------------+------------+-------------+--------+------------+
10 rows in set (0.00 sec)

mysql> 
